{
  "model_version": "0.1.0",
  "model_family": "inc15c6h-ocig-1997-internal-components",
  "original_official_federal_register_whole_issue_pdf": "evidence/hhs-counsel-source-editions/originals/oig_fr_1997_issue/sha256/75d648c24c18802812128e2708fe29340458b274d522d8e97ef38129bac1fe0d.pdf",
  "original_source_receipt": "evidence/hhs-counsel-source-editions/receipts/source-custody.json",
  "document_specific_scope": "1997 OIG FR Doc 97-14611; unrelated entire issue contents expressly excluded",
  "source_parent_OIG_canonical_identity": "INC15C3-HHS-LINK-OIG",
  "original_publication_date": "1997-06-05",
  "original_distinct_effective_date": null,
  "historical_AFG_OCIG_root_nodes": 1,
  "source_local_AFG_subordinate_functions": 4,
  "historic_source_component_rows": 5,
  "historical_whole_OIG_AF10_units": 7,
  "source_1997_ranks_not_current_2026_hierarchy": true,
  "OGC_legal_supervision_of_OCIG_not_inferred": true,
  "OIG_independent_counsel_subject_to_own_jurisdiction_source_observed": true,
  "whole_HHS_first_level_legal_denominator": null,
  "new_canonical_HHS_institution_ids": 0,
  "items": [
    {
      "id": "INC15C6H-OCIG-1997-AFG",
      "publication_local_code": "AFG",
      "historical_publisher_name": "Office of Counsel to the Inspector General",
      "archival_section": "AFG.00; AFG.10",
      "publisher_description_classification": "source_historical_legal_counsel_component",
      "source_parent_ref": "INC15C3-HHS-LINK-OIG",
      "historical_1997_section_effective_2026_certified": false,
      "source_publication_date": "1997-06-05",
      "source_1997_document": "97-14611",
      "source_1997_printed_page_range": "62 FR 30859-30865",
      "source_historical_original_sha256": "75d648c24c18802812128e2708fe29340458b274d522d8e97ef38129bac1fe0d",
      "historical_scope_summary": "Historical 1997 OCIG provides legal counsel to IG and subordinate OIG units, within OIG's own organizational boundary",
      "current_2026_component_continuity_independently_verified": false,
      "FDA_repeal_or_OGC_notice_changes_OCIG_structure_verified": false,
      "signed_current_delegation_or_individual_officeholder_verified": false,
      "no_new_canonical_federal_institution_minted": true,
      "nonadditive_prior_OIG_source_observation": true,
      "row": 1
    },
    {
      "id": "INC15C6H-OCIG-1997-ADVICE",
      "publication_local_code": "AFG-ADVICE",
      "historical_publisher_name": "Advice",
      "archival_section": "AFG.10(A); AFG.20(A)",
      "publisher_description_classification": "historical_OIG_legal_counsel_function",
      "source_parent_ref": "INC15C6H-OCIG-1997-AFG",
      "historical_1997_section_effective_2026_certified": false,
      "source_publication_date": "1997-06-05",
      "source_1997_document": "97-14611",
      "source_1997_printed_page_range": "62 FR 30859-30865",
      "source_historical_original_sha256": "75d648c24c18802812128e2708fe29340458b274d522d8e97ef38129bac1fe0d",
      "historical_scope_summary": "Counsels OIG components on IG Act scope, investigative/legal issues and internal OIG operations, with published coordination but not OGC command",
      "current_2026_component_continuity_independently_verified": false,
      "FDA_repeal_or_OGC_notice_changes_OCIG_structure_verified": false,
      "signed_current_delegation_or_individual_officeholder_verified": false,
      "no_new_canonical_federal_institution_minted": true,
      "nonadditive_prior_OIG_source_observation": true,
      "row": 2
    },
    {
      "id": "INC15C6H-OCIG-1997-CIVILREC",
      "publication_local_code": "AFG-CIVILREC",
      "historical_publisher_name": "Civil Recoveries",
      "archival_section": "AFG.10(B); AFG.20(B)",
      "publisher_description_classification": "historical_OCIG_civil_recovery_function",
      "source_parent_ref": "INC15C6H-OCIG-1997-AFG",
      "historical_1997_section_effective_2026_certified": false,
      "source_publication_date": "1997-06-05",
      "source_1997_document": "97-14611",
      "source_1997_printed_page_range": "62 FR 30859-30865",
      "source_historical_original_sha256": "75d648c24c18802812128e2708fe29340458b274d522d8e97ef38129bac1fe0d",
      "historical_scope_summary": "1997 OCIG organizational unit coordinating False Claims Act civil recoveries with DOJ and OIG, not general OMHA/DAB ALJ decision authority",
      "current_2026_component_continuity_independently_verified": false,
      "FDA_repeal_or_OGC_notice_changes_OCIG_structure_verified": false,
      "signed_current_delegation_or_individual_officeholder_verified": false,
      "no_new_canonical_federal_institution_minted": true,
      "nonadditive_prior_OIG_source_observation": true,
      "row": 3
    },
    {
      "id": "INC15C6H-OCIG-1997-ADMINLIT",
      "publication_local_code": "AFG-ADMINLIT",
      "historical_publisher_name": "Administrative Litigation",
      "archival_section": "AFG.10(C); AFG.20(C)",
      "publisher_description_classification": "historical_OCIG_administrative_litigation_function",
      "source_parent_ref": "INC15C6H-OCIG-1997-AFG",
      "historical_1997_section_effective_2026_certified": false,
      "source_publication_date": "1997-06-05",
      "source_1997_document": "97-14611",
      "source_1997_printed_page_range": "62 FR 30859-30865",
      "source_historical_original_sha256": "75d648c24c18802812128e2708fe29340458b274d522d8e97ef38129bac1fe0d",
      "historical_scope_summary": "1997 OCIG internal function for OIG administrative litigation, not legal supervision of outside adjudicative bodies",
      "current_2026_component_continuity_independently_verified": false,
      "FDA_repeal_or_OGC_notice_changes_OCIG_structure_verified": false,
      "signed_current_delegation_or_individual_officeholder_verified": false,
      "no_new_canonical_federal_institution_minted": true,
      "nonadditive_prior_OIG_source_observation": true,
      "row": 4
    },
    {
      "id": "INC15C6H-OCIG-1997-INDGUIDE",
      "publication_local_code": "AFG-INDGUIDE",
      "historical_publisher_name": "Industry Guidance",
      "archival_section": "AFG.10(D); AFG.20(D)",
      "publisher_description_classification": "historical_OCIG_industry_guidance_function",
      "source_parent_ref": "INC15C6H-OCIG-1997-AFG",
      "historical_1997_section_effective_2026_certified": false,
      "source_publication_date": "1997-06-05",
      "source_1997_document": "97-14611",
      "source_1997_printed_page_range": "62 FR 30859-30865",
      "source_historical_original_sha256": "75d648c24c18802812128e2708fe29340458b274d522d8e97ef38129bac1fe0d",
      "historical_scope_summary": "1997 OCIG internal industry guidance function, not modern whole-agency exhaustive program count",
      "current_2026_component_continuity_independently_verified": false,
      "FDA_repeal_or_OGC_notice_changes_OCIG_structure_verified": false,
      "signed_current_delegation_or_individual_officeholder_verified": false,
      "no_new_canonical_federal_institution_minted": true,
      "nonadditive_prior_OIG_source_observation": true,
      "row": 5
    }
  ]
}
